{
  "$schema": "https://json-schema.org/draft/2020-12/schema",
  "title": "AuditLog",
  "description": "An audit management log entry recording an administrative action.",
  "$id": "https://raw.githubusercontent.com/api-evangelist/palo-alto-networks/refs/heads/main/json-schema/cortex-xdr-api-audit-log-schema.json",
  "type": "object",
  "properties": {
    "timestamp": {
      "type": "integer",
      "description": "Action timestamp as Unix epoch milliseconds."
    },
    "actor_primary_username": {
      "type": "string",
      "description": "Username of the administrator who performed the action."
    },
    "actor_email": {
      "type": "string"
    },
    "actor_type": {
      "type": "string",
      "enum": [
        "User",
        "API"
      ]
    },
    "sub_type": {
      "type": "string",
      "description": "Action subtype (e.g., Login, Logout, Policy Update)."
    },
    "result": {
      "type": "string",
      "enum": [
        "SUCCESS",
        "FAIL"
      ]
    },
    "reason": {
      "type": "string",
      "description": "Failure reason if result is FAIL."
    },
    "ip": {
      "type": "string",
      "description": "Source IP address of the action."
    },
    "description": {
      "type": "string"
    }
  }
}
