{
  "timestamp": 1736428269943,
  "actor_primary_username": "jsmith",
  "actor_email": "example-actor_email",
  "actor_type": "API",
  "sub_type": "standard",
  "result": "FAIL",
  "reason": "Analysis allowed configured firewall network blocked firewall security.",
  "ip": "10.7.252.56",
  "description": "Blocked and for under suspicious on policy rule network allowed updated applied endpoint applied."
}
